<?xml version="1.0" encoding="UTF-8"?>
<dataroot xmlns:od="urn:schemas-microsoft-com:officedata" xmlns:xsi="http://www.w3.org/2000/10/XMLSchema-instance"  xsi:noNamespaceSchemaLocation="CustomersSchema.xsd">
<Customers>
<CompanyName>PZVUYFPPUK</CompanyName>
<CustomerNumber>21</CustomerNumber>
</Customers>
<Customers>
<CompanyName>GBDRCLMHPZ</CompanyName>
<CustomerNumber>22</CustomerNumber>
</Customers>
<Customers>
<CompanyName>EYHDXCVNFF</CompanyName>
<CustomerNumber>23</CustomerNumber>
</Customers>
<Customers>
<CompanyName>MKUNDKFDVA</CompanyName>
<CustomerNumber>24</CustomerNumber>
</Customers>
<Customers>
<CompanyName>VQBSNPBAXZ</CompanyName>
<CustomerNumber>25</CustomerNumber>
</Customers>
<Customers>
<CompanyName>URKBCSMSUX</CompanyName>
<CustomerNumber>26</CustomerNumber>
</Customers>
<Customers>
<CompanyName>TFVYVWOHXZ</CompanyName>
<CustomerNumber>27</CustomerNumber>
</Customers>
<Customers>
<CompanyName>HBBVEGCCHG</CompanyName>
<CustomerNumber>28</CustomerNumber>
</Customers>
<Customers>
<CompanyName>SGGRYKJZJO</CompanyName>
<CustomerNumber>29</CustomerNumber>
</Customers>
<Customers>
<CompanyName>KMHWMFFWOG</CompanyName>
<CustomerNumber>30</CustomerNumber>
</Customers>
</dataroot>
